doc_id,termo_id,categoria,campo_cadastro,termo_pt,termo_en,abreviacao_pt,abreviacao_en,campo_texto,fonte_documental,idioma_declarado,idioma_detectado,data_extracao_glossario,data_processamento,glossario_versao,pipeline_versao,texto_bruto,texto_normalizado,tokens_lematizados,num_tokens_brutos,num_tokens_lematizados,entidades_detectadas,campos_extraidos,termos_relacionados,abrevs_encontradas,abrevs_expandidas,stopwords_removidas,unidade,norma_referencia,regra_normalizacao
CORP-0213,MP004,manutencao_preditiva,tecnica_monitoramento,Análise de Vibração,Vibration Analysis,av.,VA,definicao_pt,registro_operacional,pt,pt,2026-04-29,2026-05-09,v5,v1.0,"Técnica de monitoramento de condição que mede e analisa as oscilações mecânicas do motor para identificar falhas em rolamentos, desbalanceamento, desalinhamento, frouxidão mecânica e ressonância.","Técnica de monitoramento de condição que mede e analisa as oscilações mecânicas do motor para identificar falhas em rolamentos, Desequilíbrio de Rotor desalinhamento, frouxidão mecânica e ressonância.",técnica | de | monitoramento | de | condição | mede | analisa | oscilações | mecânicas | do | motor | identificar | falha | em | rolamento | desequilíbrio | de | Rotor | desalinhamento | frouxidão | mecânica | ressonância,23,22,,{},TF005 | TF014 | CM003 | TF006,1,1,3,"mm/s, g, µm",ISO 10816-3 | ISO 20816,"Normalizar: análise vibração | vibration analysis | VA | análise de vibração → tecnica_monitoramento. Registrar espectro (Hz), grandeza (mm/s, g, μm) e método (FFT, envelope, banda de oitava). ISO 20816."
CORP-0214,MP004,manutencao_preditiva,tecnica_monitoramento,Análise de Vibração,Vibration Analysis,av.,VA,definicao_en,registro_operacional,en,en,2026-04-29,2026-05-09,v5,v1.0,"Condition monitoring technique that measures and analyzes mechanical oscillations of the motor to identify bearing faults, unbalance, misalignment, mechanical looseness, and resonance.","Condition monitoring technique that measures and analyzes mechanical oscillations of the motor to identify bearing faults, Desequilíbrio de Rotor misalignment, mechanical looseness, and resonance.",condition | monitor | technique | measur | and | analyz | mechanical | oscillation | motor | identify | bearing | fault | desequilíbrio | de | Rotor | misalignment | mechanical | loosenes | and | resonance,22,20,,{},TF005 | TF001 | CM003 | TF006 | TF014,1,1,4,"mm/s, g, µm",ISO 10816-3 | ISO 20816,"Normalizar: análise vibração | vibration analysis | VA | análise de vibração → tecnica_monitoramento. Registrar espectro (Hz), grandeza (mm/s, g, μm) e método (FFT, envelope, banda de oitava). ISO 20816."
CORP-0215,MP004,manutencao_preditiva,tecnica_monitoramento,Análise de Vibração,Vibration Analysis,av.,VA,observacoes_pt,registro_operacional,pt,pt,2026-04-29,2026-05-09,v5,v1.0,"Sensores: acelerômetro (alta frequência), velocímetro (frequência média), transdutor de deslocamento (baixa frequência/eixo).","Sensores: acelerômetro (alta frequência), velocímetro (frequência média), transdutor de deslocamento (baixa frequência/eixo).",sensor | acelerômetro | alta | frequência | velocímetro | frequência | média | transdutor | de | deslocamento | baixa | frequência | eixo,13,13,,{},CM006 | SI003 | GE004,0,0,0,"mm/s, g, µm",ISO 10816-3 | ISO 20816,"Normalizar: análise vibração | vibration analysis | VA | análise de vibração → tecnica_monitoramento. Registrar espectro (Hz), grandeza (mm/s, g, μm) e método (FFT, envelope, banda de oitava). ISO 20816."
CORP-0216,MP004,manutencao_preditiva,tecnica_monitoramento,Análise de Vibração,Vibration Analysis,av.,VA,ambiguidades,registro_operacional,pt,pt,2026-04-29,2026-05-09,v5,v1.0,"""VA"" como abreviação pode ser voltampere (elétrico) ou vibration analysis — desambiguar pelo contexto: número seguido de ""VA"" sem unidade de vibração = voltampere; análise técnica de vibração = VA preditiva.","""VA"" como abreviação pode ser voltampere (elétrico) ou vibration analysis — desambiguar pelo contexto: número seguido de ""VA"" sem unidade de vibração = voltampere; análise técnica de vibração = Análise de Vibração preditiva.","""va"" | abreviação | pode | voltampere | (elétrico) | vibration | analysis | desambiguar | pelo | contexto: | número | seguido | de | ""va"" | sem | unidade | de | vibração | voltampere; | análise | técnica | de | vibração | análise | de | vibração | preditiva.",28,27,,{},MP004 | GM004,1,1,3,"mm/s, g, µm",ISO 10816-3 | ISO 20816,"Normalizar: análise vibração | vibration analysis | VA | análise de vibração → tecnica_monitoramento. Registrar espectro (Hz), grandeza (mm/s, g, μm) e método (FFT, envelope, banda de oitava). ISO 20816."
CORP-0217,MP005,manutencao_preditiva,tecnica_monitoramento,Análise de Óleo,Oil Analysis,ao.,OA,definicao_pt,registro_operacional,pt,pt,2026-04-29,2026-05-09,v5,v1.0,"Técnica de análise laboratorial que examina amostras de lubrificante (graxa ou óleo) de mancais e redutores para detectar contaminação, degradação e partículas de desgaste metálico.","Técnica de análise laboratorial que examina amostras de lubrificante (graxa ou óleo) de mancais e redutores para detectar contaminação, degradação e partículas de desgaste metálico.",técnica | de | análise | laboratorial | examina | amostras | de | lubrificante | graxa | óleo | de | mancal | redutor | detectar | contaminação | degradação | partículas | de | desgaste | metálico,23,20,,{},TF008,0,0,3,-,ASTM D4378 | ISO 11500,"Normalizar: análise óleo | oil analysis | lubrication analysis → tecnica_monitoramento. Parâmetros: viscosidade (cSt), índice acidez (TAN), partículas (ppm). ASTM D4378."
CORP-0218,MP005,manutencao_preditiva,tecnica_monitoramento,Análise de Óleo,Oil Analysis,ao.,OA,definicao_en,registro_operacional,en,en,2026-04-29,2026-05-09,v5,v1.0,"Laboratory analysis technique that examines lubricant samples (grease or oil) from bearings and gearboxes to detect contamination, degradation, and metallic wear particles.","Laboratory analysis technique that examines lubricant samples (grease or oil) from bearings and gearboxes to detect contamination, degradation, and metallic wear particles.",laboratory | analysi | technique | examin | lubricant | sampl | grease | or | oil | from | bearing | and | gearbox | detect | contamination | degradation | and | metallic | wear | particl,22,20,,{},TF008 | CM003,0,0,2,-,ASTM D4378 | ISO 11500,"Normalizar: análise óleo | oil analysis | lubrication analysis → tecnica_monitoramento. Parâmetros: viscosidade (cSt), índice acidez (TAN), partículas (ppm). ASTM D4378."
CORP-0219,MP005,manutencao_preditiva,tecnica_monitoramento,Análise de Óleo,Oil Analysis,ao.,OA,observacoes_pt,registro_operacional,pt,pt,2026-04-29,2026-05-09,v5,v1.0,"Aplicável em mancais de deslizamento e redutores. Para motores com rolamentos, análise de graxa é menos comum.","Aplicável em mancais de Escorregamento e redutores. Para motores com rolamentos, análise de graxa é menos comum.",aplicável | em | mancal | de | escorregamento | redutor | motor | rolamento | análise | de | graxa | menos | comum,15,13,,{},GM003 | CM003,1,1,2,-,ASTM D4378 | ISO 11500,"Normalizar: análise óleo | oil analysis | lubrication analysis → tecnica_monitoramento. Parâmetros: viscosidade (cSt), índice acidez (TAN), partículas (ppm). ASTM D4378."
CORP-0220,MP005,manutencao_preditiva,tecnica_monitoramento,Análise de Óleo,Oil Analysis,ao.,OA,ambiguidades,registro_operacional,pt,pt,2026-04-29,2026-05-09,v5,v1.0,Análise de óleo em motor elétrico refere-se ao lubrificante dos rolamentos ou ao transformador de partida — qualificar: análise_oleo_rolamento vs. análise_oleo_transformador.,Análise de óleo em motor elétrico refere-se ao lubrificante dos rolamentos ou ao transformador de partida — qualificar: análise_oleo_rolamento vs. análise_oleo_transformador.,análise | de | óleo | em | motor | elétrico | refere-se | lubrificante | rolamento | transformador | de | partida | qualificar: | análise_oleo_rolamento | vs. | análise_oleo_transformador.,20,16,,{},CM003 | MP005,0,0,4,-,ASTM D4378 | ISO 11500,"Normalizar: análise óleo | oil analysis | lubrication analysis → tecnica_monitoramento. Parâmetros: viscosidade (cSt), índice acidez (TAN), partículas (ppm). ASTM D4378."
CORP-0221,MP006,manutencao_preditiva,mtbf_horas,MTBF,MTBF,MTBF,MTBF,definicao_pt,registro_operacional,pt,pt,2026-04-29,2026-05-09,v5,v1.0,Indicador de confiabilidade que representa o tempo médio de operação entre falhas consecutivas de um equipamento. Calculado pelo total de horas de operação dividido pelo número de falhas no período.,Indicador de confiabilidade que representa o tempo médio de operação entre falhas consecutivas de um equipamento. Calculado pelo total de horas de operação dividido pelo número de falhas no período.,indicador | de | confiabilidade | representa | tempo | médio | de | operação | entre | falha | consecutivas | de | equipamento | calculado | pelo | total | de | horas | de | operação | dividido | pelo | número | de | falha | período,29,26,,{},MP008 | EL008,0,0,3,horas,IEC 60050-191 | ISO 14224,Normalizar: MTBF | tempo médio entre falhas | mean time between failures → mtbf_horas. Registrar em horas. Calcular: MTBF = tempo_operacao_total / número_falhas.
CORP-0222,MP006,manutencao_preditiva,mtbf_horas,MTBF,MTBF,MTBF,MTBF,definicao_en,registro_operacional,en,en,2026-04-29,2026-05-09,v5,v1.0,Reliability indicator representing the average operating time between consecutive failures of a piece of equipment. Calculated by total operating hours divided by the number of failures in the period.,Reliability indicator representing the average operating time between consecutive failures of a piece of equipment. Calculated by total operating hours divided by the number of failures in the period.,reliability | indicator | represent | average | operat | time | between | consecutive | failure | piece | equipment | calculat | total | operat | hour | divid | number | failure | period,28,19,,{},MP008 | EL008,0,0,9,horas,IEC 60050-191 | ISO 14224,Normalizar: MTBF | tempo médio entre falhas | mean time between failures → mtbf_horas. Registrar em horas. Calcular: MTBF = tempo_operacao_total / número_falhas.
CORP-0223,MP006,manutencao_preditiva,mtbf_horas,MTBF,MTBF,MTBF,MTBF,observacoes_pt,registro_operacional,pt,pt,2026-04-29,2026-05-09,v5,v1.0,"MTBF = Tempo total de operação / Número de falhas. Quanto maior, mais confiável o equipamento.","MTBF = Tempo total de operação / Número de falhas. Quanto maior, mais confiável o equipamento.",MTBF | tempo | total | de | operação | número | de | falha | quanto | maior | confiável | equipamento,13,12,,{},MP006,1,1,1,horas,IEC 60050-191 | ISO 14224,Normalizar: MTBF | tempo médio entre falhas | mean time between failures → mtbf_horas. Registrar em horas. Calcular: MTBF = tempo_operacao_total / número_falhas.
CORP-0224,MP006,manutencao_preditiva,mtbf_horas,MTBF,MTBF,MTBF,MTBF,ambiguidades,registro_operacional,pt,misto,2026-04-29,2026-05-09,v5,v1.0,MTBF aplica-se a itens reparáveis; MTTF (Mean Time To Failure) aplica-se a itens não reparáveis — motor elétrico industrial = item reparável → usar MTBF.,MTBF aplica-se a itens reparáveis; MTTF (Mean Time To Failure) aplica-se a itens não reparáveis — motor elétrico industrial = item reparável → usar MTBF,MTBF | aplica-se | itens | reparáveis; | mttf | (mean | time | failure) | aplica-se | itens | não | reparáveis | motor | elétrico | industrial | item | reparável | usar | MTBF,20,19,,{},MP006,2,2,1,horas,IEC 60050-191 | ISO 14224,Normalizar: MTBF | tempo médio entre falhas | mean time between failures → mtbf_horas. Registrar em horas. Calcular: MTBF = tempo_operacao_total / número_falhas.
CORP-0225,MP007,manutencao_preditiva,mttr_horas,MTTR,MTTR,MTTR,MTTR,definicao_pt,registro_operacional,pt,pt,2026-04-29,2026-05-09,v5,v1.0,"Indicador de manutenção que representa o tempo médio necessário para reparar e colocar o equipamento novamente em operação após uma falha, incluindo diagnóstico, substituição e testes.","Indicador de manutenção que representa o tempo médio necessário para reparar e colocar o equipamento novamente em operação após uma falha, incluindo diagnóstico, substituição e testes.",indicador | de | manutenção | representa | tempo | médio | necessário | reparar | colocar | equipamento | novamente | em | operação | após | falha | incluir | diagnóstico | substituição | testes,22,19,,{},,0,0,3,horas,IEC 60050-191 | ISO 14224,Normalizar: MTTR | tempo médio reparo | mean time to repair → mttr_horas. Registrar em horas. Calcular: MTTR = tempo_total_reparo / número_reparos.
CORP-0226,MP007,manutencao_preditiva,mttr_horas,MTTR,MTTR,MTTR,MTTR,definicao_en,registro_operacional,en,en,2026-04-29,2026-05-09,v5,v1.0,"Maintenance indicator representing the average time needed to repair and return the equipment to operation after a failure, including diagnosis, replacement, and testing.","Maintenance indicator representing the average time needed to repair and return the equipment to operation after a failure, including diagnosis, replacement, and testing.",maintenance | indicator | represent | average | time | need | repair | and | return | equipment | operation | after | failure | includ | diagnosi | replacement | and | test,22,18,,{},,0,0,4,horas,IEC 60050-191 | ISO 14224,Normalizar: MTTR | tempo médio reparo | mean time to repair → mttr_horas. Registrar em horas. Calcular: MTTR = tempo_total_reparo / número_reparos.
CORP-0227,MP007,manutencao_preditiva,mttr_horas,MTTR,MTTR,MTTR,MTTR,observacoes_pt,registro_operacional,pt,pt,2026-04-29,2026-05-09,v5,v1.0,MTTR = Tempo total de reparo / Número de falhas. Menor MTTR indica maior capacidade de resposta da equipe de manutenção.,MTTR = Tempo total de reparo / Número de falhas. Menor MTTR indica maior capacidade de resposta da equipe de manutenção.,MTTR | tempo | total | de | reparo | número | de | falha | menor | MTTR | indica | maior | capacidade | de | resposta | equipe | de | manutenção,19,18,,{},MP007,2,2,1,horas,IEC 60050-191 | ISO 14224,Normalizar: MTTR | tempo médio reparo | mean time to repair → mttr_horas. Registrar em horas. Calcular: MTTR = tempo_total_reparo / número_reparos.
CORP-0228,MP007,manutencao_preditiva,mttr_horas,MTTR,MTTR,MTTR,MTTR,ambiguidades,registro_operacional,pt,misto,2026-04-29,2026-05-09,v5,v1.0,"MTTR pode significar ""Mean Time To Repair"" ou ""Mean Time To Restore"" (inclui tempo logístico) — adotar IEC 60050-191: MTTR = tempo de reparo ativo, excluindo espera por peças.","MTTR pode significar ""Mean Time To Repair"" ou ""Mean Time To Restore"" (inclui tempo logístico) — adotar IEC 60050-191: MTTR = tempo de reparo ativo, excluindo espera por peças.","MTTR | pode | significar | ""mean | time | repair"" | ""mean | time | restore"" | (inclui | tempo | logístico) | adotar | iec | 60050-191: | MTTR | tempo | de | reparo | ativo, | excluir | espera | peças.",27,23,IEC 60050-191,{'norma_referencia': 'IEC 60050-191'},MP007,2,2,4,horas,IEC 60050-191 | ISO 14224,Normalizar: MTTR | tempo médio reparo | mean time to repair → mttr_horas. Registrar em horas. Calcular: MTTR = tempo_total_reparo / número_reparos.
CORP-0229,MP008,manutencao_preditiva,horas_operacao_total,Horas de Operação,Operating Hours,hs. op.,OH,definicao_pt,registro_operacional,pt,pt,2026-04-29,2026-05-09,v5,v1.0,Total de horas em que o motor esteve energizado e em operação. Parâmetro fundamental para programação de manutenções periódicas e cálculo de indicadores de confiabilidade.,Total de horas em que o motor esteve energizado e em operação. Parâmetro fundamental para programação de manutenções periódicas e cálculo de indicadores de confiabilidade.,total | de | horas | em | motor | esteve | energizado | em | operação | parâmetro | fundamental | programação | de | manutenções | periódicas | cálculo | de | indicador | de | confiabilidade,22,20,,{},EL008,0,0,2,h (horas),ISO 14224,Normalizar: horas operação | run hours | operating hours | horímetro → horas_operacao_total. Registrar como inteiro ou float em horas decimais. Incrementar a cada ciclo de leitura.
CORP-0230,MP008,manutencao_preditiva,horas_operacao_total,Horas de Operação,Operating Hours,hs. op.,OH,definicao_en,registro_operacional,en,en,2026-04-29,2026-05-09,v5,v1.0,Total hours the motor has been energized and in operation. Fundamental parameter for scheduling periodic maintenance and calculating reliability indicators.,Total hours the motor has been energized and in operation. Fundamental parameter for scheduling periodic maintenance and calculating reliability indicators.,total | hour | motor | has | energiz | and | operation | fundamental | parameter | schedul | periodic | maintenance | and | calculat | reliability | indicator,20,16,,{},,0,0,4,h (horas),ISO 14224,Normalizar: horas operação | run hours | operating hours | horímetro → horas_operacao_total. Registrar como inteiro ou float em horas decimais. Incrementar a cada ciclo de leitura.
CORP-0231,MP008,manutencao_preditiva,horas_operacao_total,Horas de Operação,Operating Hours,hs. op.,OH,observacoes_pt,registro_operacional,pt,pt,2026-04-29,2026-05-09,v5,v1.0,"Monitorado por horímetro físico ou sistema SCADA/DCS. Usado para calcular intervalo de troca de graxa, revisão geral, etc.","Monitorado por Horas de Operação físico ou sistema SCADA/DCS. Usado para calcular intervalo de troca de graxa, revisão geral, etc.",monitorado | horas | de | operação | físico | sistema | scada | dcs | usado | calcular | intervalo | de | troca | de | graxa | revisão | geral | etc,19,18,,{},MP008 | EL008,1,1,3,h (horas),ISO 14224,Normalizar: horas operação | run hours | operating hours | horímetro → horas_operacao_total. Registrar como inteiro ou float em horas decimais. Incrementar a cada ciclo de leitura.
CORP-0232,MP008,manutencao_preditiva,horas_operacao_total,Horas de Operação,Operating Hours,hs. op.,OH,ambiguidades,registro_operacional,pt,pt,2026-04-29,2026-05-09,v5,v1.0,Horas de operação totais diferem de horas de operação desde a última manutenção — manter dois campos separados: horas_operacao_total (cumulativo desde instalação) e horas_desde_manutencao.,Horas de operação totais diferem de horas de operação desde a última manutenção — manter dois campos separados: Horímetro (cumulativo desde instalação) e horas_desde_manutencao.,horas | de | operação | total | diferem | de | horas | de | operação | desde | última | manutenção | manter | dois | campo | separados: | horímetro | (cumulativo | desde | instalação) | horas_desde_manutencao.,21,21,,{},MP008 | EL008 | MP005,1,1,0,h (horas),ISO 14224,Normalizar: horas operação | run hours | operating hours | horímetro → horas_operacao_total. Registrar como inteiro ou float em horas decimais. Incrementar a cada ciclo de leitura.
CORP-0233,SI001,sensores_instrumentacao,sensor_temperatura_tipo,PT100,PT100,PT100,PT100,definicao_pt,manual_tecnico,pt,pt,2026-04-29,2026-05-09,v5,v1.0,Sensor de temperatura do tipo RTD (Detector de Temperatura por Resistência) baseado em platina com resistência de 100 Ω a 0°C. Usado para monitoramento de temperatura em enrolamentos (Classe H: max 180°C) e mancais.,Sensor de temperatura do tipo PT100 (Detector de Temperatura por Resistência) baseado em platina com resistência de 100 Ω a 0°C. Usado para monitoramento de temperatura em enrolamentos (Classe H: max 180°C) e mancais.,sensor | de | temperatura | do | tipo | PT100 | detector | de | temperatura | resistência | baseado | em | platina | resistência | de | 100 | usado | monitoramento | de | temperatura | em | enrolamento | classe | max | 180 | mancal,29,26,PT100,{'codigo_evento': 100.0},GM005 | CM004 | SI001 | CM003,1,1,3,Ω (Ohm) → °C,IEC 60751 | DIN EN 60751,"Normalizar: PT100 | Pt100 | RTD | resistance thermometer → sensor_temperatura_tipo. Valores aceitos: PT100 | PT1000 | PT50 | NI120. Normalizar grafias: ""pt100"" | ""PT-100"" → ""PT100"". Curva IEC 60751."
CORP-0234,SI001,sensores_instrumentacao,sensor_temperatura_tipo,PT100,PT100,PT100,PT100,definicao_en,manual_tecnico,en,en,2026-04-29,2026-05-09,v5,v1.0,RTD (Resistance Temperature Detector) type temperature sensor based on platinum with resistance of 100 Ω at 0°C. Used for temperature monitoring in windings (Class H: max 180°C) and bearings.,PT100 (Resistance Temperature Detector) type temperature sensor based on platinum with resistance of 100 Ω at 0°C. Used for temperature monitoring in windings (Class H: max 180°C) and bearings.,PT100 | resistance | Temperature | detector | type | temperature | sensor | bas | platinum | with | resistance | 100 | used | temperature | monitor | winding | clas | max | 180 | and | bearing,26,21,PT100,{'codigo_evento': 100.0},GM005 | CM004 | SI001 | CM003,1,1,5,Ω (Ohm) → °C,IEC 60751 | DIN EN 60751,"Normalizar: PT100 | Pt100 | RTD | resistance thermometer → sensor_temperatura_tipo. Valores aceitos: PT100 | PT1000 | PT50 | NI120. Normalizar grafias: ""pt100"" | ""PT-100"" → ""PT100"". Curva IEC 60751."
CORP-0235,SI001,sensores_instrumentacao,sensor_temperatura_tipo,PT100,PT100,PT100,PT100,observacoes_pt,manual_tecnico,pt,pt,2026-04-29,2026-05-09,v5,v1.0,Embedded nos enrolamentos durante a fabricação (3 ou 6 sensores em motores grandes). Requer transmissor ou entrada analógica no CLP/SCADA.,Embedded nos enrolamentos durante a fabricação (3 ou 6 sensores em motores grandes). Requer transmissor ou entrada analógica no CLP/SCADA.,embedded | enrolamento | fabricação | sensor | em | motor | grandes | requer | transmissor | entrada | analógica | clp | scada,18,13,,{},CM004 | CM003,0,0,5,Ω (Ohm) → °C,IEC 60751 | DIN EN 60751,"Normalizar: PT100 | Pt100 | RTD | resistance thermometer → sensor_temperatura_tipo. Valores aceitos: PT100 | PT1000 | PT50 | NI120. Normalizar grafias: ""pt100"" | ""PT-100"" → ""PT100"". Curva IEC 60751."
CORP-0236,SI001,sensores_instrumentacao,sensor_temperatura_tipo,PT100,PT100,PT100,PT100,ambiguidades,manual_tecnico,pt,pt,2026-04-29,2026-05-09,v5,v1.0,PT100 e NTC/PTC são tecnologias de sensores de temperatura distintas — PT100 é RTD (resistência metálica linear); PTC/NTC são termistores (resposta não linear). Não intercambiar.,PT100 e NTC/PTC são tecnologias de sensores de temperatura distintas — PT100 é PT100 (resistência metálica linear); PTC/NTC são termistores (resposta não linear). Não intercambiar.,PT100 | ntc/ptc | são | tecnologias | de | sensor | de | temperatura | distintas | PT100 | PT100 | (resistência | metálica | linear); | ptc/ntc | são | termistor | (resposta | não | linear). | não | intercambiar.,22,22,PT100 | PT100 | PT100,{'codigo_evento': 100.0},SI002 | GM005 | SI001 | MP010,3,3,0,Ω (Ohm) → °C,IEC 60751 | DIN EN 60751,"Normalizar: PT100 | Pt100 | RTD | resistance thermometer → sensor_temperatura_tipo. Valores aceitos: PT100 | PT1000 | PT50 | NI120. Normalizar grafias: ""pt100"" | ""PT-100"" → ""PT100"". Curva IEC 60751."
CORP-0237,SI002,sensores_instrumentacao,protecao_termica_tipo,Termistor PTC,PTC Thermistor,PTC,PTC,definicao_pt,manual_tecnico,pt,pt,2026-04-29,2026-05-09,v5,v1.0,Sensor de temperatura com resistência que aumenta drasticamente acima de uma temperatura de comutação definida. Usado como proteção binária (liga/desliga) contra sobreaquecimento em motores. Instalado no enrolamento.,Sensor de temperatura com resistência que aumenta drasticamente acima de uma temperatura de comutação definida. Usado como proteção binária (liga/desliga) contra Sobrecarga Térmica em motores. Instalado no enrolamento.,sensor | de | temperatura | resistência | aumenta | drasticamente | acima | de | temperatura | de | comutação | definida | usado | proteção | binária | liga | desliga | contra | sobrecarga | térmica | em | motor | instalado | enrolamento,28,24,,{},GM005 | CM004 | CM003 | TF007,1,1,5,-,IEC 60034-11,Normalizar: PTC | termistor PTC | thermal protection | KTY → protecao_termica_tipo. Valores: PTC_110 | PTC_120 | PTC_130 | PTC_140 | PTC_155 | PTC_180 (temperatura de trip em °C). IEC 60034-11.
CORP-0238,SI002,sensores_instrumentacao,protecao_termica_tipo,Termistor PTC,PTC Thermistor,PTC,PTC,definicao_en,manual_tecnico,en,en,2026-04-29,2026-05-09,v5,v1.0,Temperature sensor with resistance that increases dramatically above a defined switching temperature. Used as binary protection (on/off) against overheating in motors. Installed in the winding.,Temperature sensor with resistance that increases dramatically above a defined switching temperature. Used as binary protection (on/off) against Sobrecarga Térmica in motors. Installed in the winding.,Temperature | sensor | with | resistance | increas | dramatically | above | defin | switch | temperature | used | binary | protection | off | against | sobrecarga | térmica | motor | install | winding,25,20,,{},GM005 | CM004 | TF007,1,1,6,-,IEC 60034-11,Normalizar: PTC | termistor PTC | thermal protection | KTY → protecao_termica_tipo. Valores: PTC_110 | PTC_120 | PTC_130 | PTC_140 | PTC_155 | PTC_180 (temperatura de trip em °C). IEC 60034-11.
